"BROKEN","EPIC","FAILED","FEATURE","PASSED","SKIPPED","STORY","UNKNOWN"
"0","Contacts","0","Contacts","7","0","Create new contact","0"
"0","Login","0","Login","1","0","Login with valid credentials","0"
"0","Login","0","Login","1","0","Reset password when using  Inactif email","0"
"0","","0","","1","0","","0"
"0","Login","0","Login","1","0","Fails reset password when using wrong email","0"
"0","Login","0","Login","1","0","Login with invalid credentials","0"
"0","Login","0","Login","1","0","Login with inactif credentials","0"
